14:19:29.636056 ARP, Request who-has _gateway tell tom, length 28
14:19:29.640605 ARP, Reply _gateway is-at 24:95:04:b0:1f:78 (oui Unknown), length 46
14:19:29.826911 ARP, Request who-has GARAGE (Broadcast) tell _gateway, length 46
14:19:30.435316 IP tom.36051 > _gateway.domain: 42013+ PTR? 74.1.168.192.in-addr.arpa. (43)
14:19:30.439256 IP _gateway.domain > tom.36051: 42013* 1/0/0 PTR GARAGE. (63)
14:19:31.671640 ARP, Request who-has AmazonPlug00G0 (Broadcast) tell _gateway, length 46
14:19:31.816437 IP ESP32-Tom.63609 > tom.mqtt: Flags [S], seq 710621657, win 5744, options [mss 1436], length 0
14:19:31.816496 IP tom.mqtt > ESP32-Tom.63609: Flags [R.], seq 0, ack 710621658, win 0, length 0
14:19:32.023350 IP 192.168.1.27.ezmeeting-2 > 239.255.255.251.ezmeeting-2: UDP, length 38
14:19:32.023363 IP 192.168.1.27.ezmeeting-2 > 224.0.0.250.ezmeeting-2: UDP, length 38
14:19:32.090308 ARP, Request who-has TERRASSE tell _gateway, length 46
14:19:32.459787 IP tom.42439 > _gateway.domain: 18234+ PTR? 94.1.168.192.in-addr.arpa. (43)
14:19:32.463712 IP _gateway.domain > tom.42439: 18234* 1/0/0 PTR AmazonPlug00G0. (71)
14:19:32.464658 IP tom.58017 > _gateway.domain: 34360+ PTR? 34.1.168.192.in-addr.arpa. (43)
14:19:32.468371 IP _gateway.domain > tom.58017: 34360* 1/0/0 PTR ESP32-Tom. (66)
14:19:32.469491 IP tom.45823 > _gateway.domain: 61774+ PTR? 251.255.255.239.in-addr.arpa. (46)
14:19:32.610893 IP _gateway.domain > tom.45823: 61774 NXDomain 0/1/0 (103)
14:19:32.611346 IP tom.35015 > _gateway.domain: 39014+ PTR? 27.1.168.192.in-addr.arpa. (43)
14:19:32.615122 IP _gateway.domain > tom.35015: 39014 NXDomain* 0/0/0 (43)
14:19:32.615705 IP tom.38155 > _gateway.domain: 46512+ PTR? 250.0.0.224.in-addr.arpa. (42)
14:19:32.751512 IP _gateway.domain > tom.38155: 46512 NXDomain 0/1/0 (99)
14:19:32.752442 IP tom.36835 > _gateway.domain: 33769+ PTR? 88.1.168.192.in-addr.arpa. (43)
14:19:32.756124 IP _gateway.domain > tom.36835: 33769* 1/0/0 PTR TERRASSE. (65)
14:19:33.496661 IP _gateway.58948 > 239.255.255.250.ssdp: UDP, length 399
14:19:33.497714 IP _gateway.58948 > 239.255.255.250.ssdp: UDP, length 471
14:19:33.498760 IP _gateway.58948 > 239.255.255.250.ssdp: UDP, length 408
14:19:33.499839 IP _gateway.58948 > 239.255.255.250.ssdp: UDP, length 467
14:19:33.502810 IP _gateway.58948 > 239.255.255.250.ssdp: UDP, length 408
14:19:33.503915 IP _gateway.58948 > 239.255.255.250.ssdp: UDP, length 447
14:19:33.504827 IP _gateway.58948 > 239.255.255.250.ssdp: UDP, length 408
14:19:33.505965 IP _gateway.58948 > 239.255.255.250.ssdp: UDP, length 461
14:19:33.525169 IP _gateway.58948 > 239.255.255.250.ssdp: UDP, length 479
14:19:33.526299 IP _gateway.58948 > 239.255.255.250.ssdp: UDP, length 463
14:19:33.527264 IP _gateway.58948 > 239.255.255.250.ssdp: UDP, length 463
14:19:33.528429 IP _gateway.58948 > 239.255.255.250.ssdp: UDP, length 451
14:19:33.529934 IP _gateway.58948 > 239.255.255.250.ssdp: UDP, length 408
14:19:33.531027 IP _gateway.58948 > 239.255.255.250.ssdp: UDP, length 445
14:19:33.755156 IP _gateway.58948 > 239.255.255.250.ssdp: UDP, length 445
14:19:33.756224 IP _gateway.58948 > 239.255.255.250.ssdp: UDP, length 408
14:19:33.757287 IP _gateway.58948 > 239.255.255.250.ssdp: UDP, length 451
14:19:33.758332 IP _gateway.58948 > 239.255.255.250.ssdp: UDP, length 463
14:19:33.773325 IP _gateway.58948 > 239.255.255.250.ssdp: UDP, length 463
14:19:33.774354 IP _gateway.58948 > 239.255.255.250.ssdp: UDP, length 479
14:19:33.775417 IP _gateway.58948 > 239.255.255.250.ssdp: UDP, length 461
14:19:33.776444 IP _gateway.58948 > 239.255.255.250.ssdp: UDP, length 408
14:19:33.777950 IP _gateway.58948 > 239.255.255.250.ssdp: UDP, length 447
14:19:33.779031 IP _gateway.58948 > 239.255.255.250.ssdp: UDP, length 408
14:19:33.780084 IP _gateway.58948 > 239.255.255.250.ssdp: UDP, length 467
14:19:33.781151 IP _gateway.58948 > 239.255.255.250.ssdp: UDP, length 408
14:19:33.782696 IP _gateway.58948 > 239.255.255.250.ssdp: UDP, length 471
14:19:33.783727 IP _gateway.58948 > 239.255.255.250.ssdp: UDP, length 399
14:19:33.822372 ARP, Request who-has C310_C2B8E7 (Broadcast) tell _gateway, length 46
14:19:34.490032 IP tom.48599 > _gateway.domain: 40574+ PTR? 250.255.255.239.in-addr.arpa. (46)
14:19:34.621990 IP _gateway.domain > tom.48599: 40574 NXDomain 0/1/0 (103)
14:19:34.623239 IP tom.46914 > _gateway.domain: 48184+ PTR? 71.1.168.192.in-addr.arpa. (43)
14:19:34.627033 IP _gateway.domain > tom.46914: 48184* 1/0/0 PTR C310_C2B8E7. (68)
14:19:34.805847 IP tom.55937 > 204.11.65.81.rev.sfr.net.https: UDP, length 1181
14:19:34.855143 ARP, Request who-has amazon-264387ef0 (Broadcast) tell _gateway, length 46
14:19:34.927267 IP tom.55937 > 204.11.65.81.rev.sfr.net.https: UDP, length 29
14:19:34.927335 IP tom.55937 > 204.11.65.81.rev.sfr.net.https: UDP, length 29
14:19:34.961931 IP 204.11.65.81.rev.sfr.net.https > tom.55937: UDP, length 32
14:19:34.961971 IP 204.11.65.81.rev.sfr.net.https > tom.55937: UDP, length 139
14:19:34.963367 IP tom.55937 > 204.11.65.81.rev.sfr.net.https: UDP, length 39
14:19:34.973298 IP 204.11.65.81.rev.sfr.net.https > tom.55937: UDP, length 1352
14:19:34.973364 IP 204.11.65.81.rev.sfr.net.https > tom.55937: UDP, length 1357
14:19:34.973490 IP 204.11.65.81.rev.sfr.net.https > tom.55937: UDP, length 1357
14:19:34.973546 IP 204.11.65.81.rev.sfr.net.https > tom.55937: UDP, length 1357
14:19:34.973700 IP 204.11.65.81.rev.sfr.net.https > tom.55937: UDP, length 1357
14:19:34.973828 IP 204.11.65.81.rev.sfr.net.https > tom.55937: UDP, length 1357
14:19:34.973944 IP 204.11.65.81.rev.sfr.net.https > tom.55937: UDP, length 1357
14:19:34.974067 IP 204.11.65.81.rev.sfr.net.https > tom.55937: UDP, length 1357
14:19:34.974123 IP 204.11.65.81.rev.sfr.net.https > tom.55937: UDP, length 1357
14:19:34.974269 IP 204.11.65.81.rev.sfr.net.https > tom.55937: UDP, length 1357
14:19:34.974402 IP 204.11.65.81.rev.sfr.net.https > tom.55937: UDP, length 1357
14:19:34.974458 IP 204.11.65.81.rev.sfr.net.https > tom.55937: UDP, length 1357
14:19:34.974610 IP 204.11.65.81.rev.sfr.net.https > tom.55937: UDP, length 1357
14:19:34.974725 IP 204.11.65.81.rev.sfr.net.https > tom.55937: UDP, length 1357
14:19:34.974841 IP 204.11.65.81.rev.sfr.net.https > tom.55937: UDP, length 1357
14:19:34.975652 IP tom.55937 > 204.11.65.81.rev.sfr.net.https: UDP, length 33
14:19:34.985104 IP 204.11.65.81.rev.sfr.net.https > tom.55937: UDP, length 1357
14:19:34.985224 IP 204.11.65.81.rev.sfr.net.https > tom.55937: UDP, length 1357
14:19:34.985361 IP 204.11.65.81.rev.sfr.net.https > tom.55937: UDP, length 1357
14:19:34.985539 IP 204.11.65.81.rev.sfr.net.https > tom.55937: UDP, length 1357
14:19:34.985613 IP 204.11.65.81.rev.sfr.net.https > tom.55937: UDP, length 1357
14:19:34.985640 IP tom.55937 > 204.11.65.81.rev.sfr.net.https: UDP, length 33
14:19:34.985727 IP 204.11.65.81.rev.sfr.net.https > tom.55937: UDP, length 1357
14:19:34.985840 IP 204.11.65.81.rev.sfr.net.https > tom.55937: UDP, length 1357
14:19:34.985955 IP 204.11.65.81.rev.sfr.net.https > tom.55937: UDP, length 1357
14:19:34.986069 IP 204.11.65.81.rev.sfr.net.https > tom.55937: UDP, length 1357
14:19:34.986263 IP 204.11.65.81.rev.sfr.net.https > tom.55937: UDP, length 1357
14:19:34.986307 IP 204.11.65.81.rev.sfr.net.https > tom.55937: UDP, length 1357
14:19:34.986494 IP 204.11.65.81.rev.sfr.net.https > tom.55937: UDP, length 1357
14:19:34.986531 IP 204.11.65.81.rev.sfr.net.https > tom.55937: UDP, length 1357
14:19:34.986646 IP 204.11.65.81.rev.sfr.net.https > tom.55937: UDP, length 1357
14:19:34.986846 IP 204.11.65.81.rev.sfr.net.https > tom.55937: UDP, length 1357
14:19:34.986879 IP 204.11.65.81.rev.sfr.net.https > tom.55937: UDP, length 1357
14:19:34.986978 IP 204.11.65.81.rev.sfr.net.https > tom.55937: UDP, length 1357
14:19:34.987126 IP 204.11.65.81.rev.sfr.net.https > tom.55937: UDP, length 1357
14:19:34.987320 IP 204.11.65.81.rev.sfr.net.https > tom.55937: UDP, length 1357
14:19:34.987506 IP tom.55937 > 204.11.65.81.rev.sfr.net.https: UDP, length 33
14:19:34.997817 IP 204.11.65.81.rev.sfr.net.https > tom.55937: UDP, length 1357
14:19:34.997911 IP 204.11.65.81.rev.sfr.net.https > tom.55937: UDP, length 1357
14:19:34.998112 IP 204.11.65.81.rev.sfr.net.https > tom.55937: UDP, length 1357
14:19:34.998328 IP 204.11.65.81.rev.sfr.net.https > tom.55937: UDP, length 1357
14:19:34.998360 IP 204.11.65.81.rev.sfr.net.https > tom.55937: UDP, length 1357
14:19:34.998427 IP tom.55937 > 204.11.65.81.rev.sfr.net.https: UDP, length 33
14:19:34.998454 IP 204.11.65.81.rev.sfr.net.https > tom.55937: UDP, length 1357
14:19:34.998567 IP 204.11.65.81.rev.sfr.net.https > tom.55937: UDP, length 1357
14:19:34.998681 IP 204.11.65.81.rev.sfr.net.https > tom.55937: UDP, length 1357
14:19:34.998759 IP tom.55937 > 204.11.65.81.rev.sfr.net.https: UDP, length 33
14:19:34.998803 IP 204.11.65.81.rev.sfr.net.https > tom.55937: UDP, length 1357
14:19:34.998918 IP 204.11.65.81.rev.sfr.net.https > tom.55937: UDP, length 1357
14:19:34.999086 IP 204.11.65.81.rev.sfr.net.https > tom.55937: UDP, length 1357
14:19:34.999189 IP tom.55937 > 204.11.65.81.rev.sfr.net.https: UDP, length 33
14:19:34.999221 IP 204.11.65.81.rev.sfr.net.https > tom.55937: UDP, length 1357
14:19:34.999349 IP 204.11.65.81.rev.sfr.net.https > tom.55937: UDP, length 1357
14:19:34.999449 IP 204.11.65.81.rev.sfr.net.https > tom.55937: UDP, length 1357
14:19:34.999656 IP 204.11.65.81.rev.sfr.net.https > tom.55937: UDP, length 1357
14:19:34.999670 IP tom.55937 > 204.11.65.81.rev.sfr.net.https: UDP, length 33
14:19:34.999692 IP 204.11.65.81.rev.sfr.net.https > tom.55937: UDP, length 1357
14:19:34.999997 IP tom.55937 > 204.11.65.81.rev.sfr.net.https: UDP, length 33
14:19:35.010739 IP 204.11.65.81.rev.sfr.net.https > tom.55937: UDP, length 1357
14:19:35.010803 IP 204.11.65.81.rev.sfr.net.https > tom.55937: UDP, length 1357
14:19:35.011460 IP 204.11.65.81.rev.sfr.net.https > tom.55937: UDP, length 1357
14:19:35.012052 IP tom.55937 > 204.11.65.81.rev.sfr.net.https: UDP, length 33
14:19:35.015052 IP 204.11.65.81.rev.sfr.net.https > tom.55937: UDP, length 1357
14:19:35.015124 IP 204.11.65.81.rev.sfr.net.https > tom.55937: UDP, length 1357
14:19:35.015213 IP 204.11.65.81.rev.sfr.net.https > tom.55937: UDP, length 1357
14:19:35.015329 IP 204.11.65.81.rev.sfr.net.https > tom.55937: UDP, length 1357
14:19:35.015442 IP 204.11.65.81.rev.sfr.net.https > tom.55937: UDP, length 1357
14:19:35.015556 IP 204.11.65.81.rev.sfr.net.https > tom.55937: UDP, length 1357
14:19:35.015670 IP 204.11.65.81.rev.sfr.net.https > tom.55937: UDP, length 1357
14:19:35.015783 IP 204.11.65.81.rev.sfr.net.https > tom.55937: UDP, length 1357
14:19:35.015902 IP 204.11.65.81.rev.sfr.net.https > tom.55937: UDP, length 1357
14:19:35.016013 IP 204.11.65.81.rev.sfr.net.https > tom.55937: UDP, length 1357
14:19:35.016124 IP 204.11.65.81.rev.sfr.net.https > tom.55937: UDP, length 1357
14:19:35.016283 IP 204.11.65.81.rev.sfr.net.https > tom.55937: UDP, length 1357
14:19:35.016345 IP 204.11.65.81.rev.sfr.net.https > tom.55937: UDP, length 1357
14:19:35.016459 IP 204.11.65.81.rev.sfr.net.https > tom.55937: UDP, length 1357
14:19:35.016573 IP 204.11.65.81.rev.sfr.net.https > tom.55937: UDP, length 1357
14:19:35.016687 IP 204.11.65.81.rev.sfr.net.https > tom.55937: UDP, length 1357
14:19:35.016801 IP 204.11.65.81.rev.sfr.net.https > tom.55937: UDP, length 1357
14:19:35.016972 IP tom.55937 > 204.11.65.81.rev.sfr.net.https: UDP, length 33
14:19:35.025605 IP 204.11.65.81.rev.sfr.net.https > tom.55937: UDP, length 1357
14:19:35.025703 IP 204.11.65.81.rev.sfr.net.https > tom.55937: UDP, length 1357
14:19:35.025791 IP 204.11.65.81.rev.sfr.net.https > tom.55937: UDP, length 1357
14:19:35.025906 IP 204.11.65.81.rev.sfr.net.https > tom.55937: UDP, length 1357
14:19:35.026019 IP 204.11.65.81.rev.sfr.net.https > tom.55937: UDP, length 1357
14:19:35.026132 IP 204.11.65.81.rev.sfr.net.https > tom.55937: UDP, length 1357
14:19:35.026264 IP 204.11.65.81.rev.sfr.net.https > tom.55937: UDP, length 1357
14:19:35.026376 IP 204.11.65.81.rev.sfr.net.https > tom.55937: UDP, length 1357
14:19:35.026488 IP 204.11.65.81.rev.sfr.net.https > tom.55937: UDP, length 1357
14:19:35.026768 IP tom.55937 > 204.11.65.81.rev.sfr.net.https: UDP, length 33
14:19:35.034454 IP 204.11.65.81.rev.sfr.net.https > tom.55937: UDP, length 1357
14:19:35.034525 IP 204.11.65.81.rev.sfr.net.https > tom.55937: UDP, length 1357
14:19:35.034569 IP 204.11.65.81.rev.sfr.net.https > tom.55937: UDP, length 1357
14:19:35.034692 IP 204.11.65.81.rev.sfr.net.https > tom.55937: UDP, length 1357
14:19:35.034793 IP 204.11.65.81.rev.sfr.net.https > tom.55937: UDP, length 1357
14:19:35.034907 IP 204.11.65.81.rev.sfr.net.https > tom.55937: UDP, length 1357
14:19:35.035020 IP 204.11.65.81.rev.sfr.net.https > tom.55937: UDP, length 1357
14:19:35.035135 IP 204.11.65.81.rev.sfr.net.https > tom.55937: UDP, length 1357
14:19:35.035249 IP 204.11.65.81.rev.sfr.net.https > tom.55937: UDP, length 1357
14:19:35.035279 IP tom.55937 > 204.11.65.81.rev.sfr.net.https: UDP, length 33
14:19:35.035363 IP 204.11.65.81.rev.sfr.net.https > tom.55937: UDP, length 1357
14:19:35.035478 IP 204.11.65.81.rev.sfr.net.https > tom.55937: UDP, length 1357
14:19:35.035590 IP 204.11.65.81.rev.sfr.net.https > tom.55937: UDP, length 1357
14:19:35.035708 IP 204.11.65.81.rev.sfr.net.https > tom.55937: UDP, length 1357
14:19:35.035769 IP tom.55937 > 204.11.65.81.rev.sfr.net.https: UDP, length 33
14:19:35.035822 IP 204.11.65.81.rev.sfr.net.https > tom.55937: UDP, length 1357
14:19:35.035947 IP 204.11.65.81.rev.sfr.net.https > tom.55937: UDP, length 1357
14:19:35.036054 IP 204.11.65.81.rev.sfr.net.https > tom.55937: UDP, length 1357
14:19:35.036167 IP 204.11.65.81.rev.sfr.net.https > tom.55937: UDP, length 1357
14:19:35.036281 IP 204.11.65.81.rev.sfr.net.https > tom.55937: UDP, length 1357
14:19:35.036394 IP 204.11.65.81.rev.sfr.net.https > tom.55937: UDP, length 1357
14:19:35.036508 IP 204.11.65.81.rev.sfr.net.https > tom.55937: UDP, length 1357
14:19:35.036622 IP 204.11.65.81.rev.sfr.net.https > tom.55937: UDP, length 1357
14:19:35.036756 IP 204.11.65.81.rev.sfr.net.https > tom.55937: UDP, length 1357
14:19:35.037637 IP tom.55937 > 204.11.65.81.rev.sfr.net.https: UDP, length 33
14:19:35.046518 IP 204.11.65.81.rev.sfr.net.https > tom.55937: UDP, length 1357
14:19:35.046650 IP 204.11.65.81.rev.sfr.net.https > tom.55937: UDP, length 1357
14:19:35.046786 IP 204.11.65.81.rev.sfr.net.https > tom.55937: UDP, length 1357
14:19:35.046939 IP 204.11.65.81.rev.sfr.net.https > tom.55937: UDP, length 1357
14:19:35.047053 IP 204.11.65.81.rev.sfr.net.https > tom.55937: UDP, length 1357
14:19:35.047169 IP 204.11.65.81.rev.sfr.net.https > tom.55937: UDP, length 1357
14:19:35.047281 IP 204.11.65.81.rev.sfr.net.https > tom.55937: UDP, length 1357
14:19:35.047394 IP 204.11.65.81.rev.sfr.net.https > tom.55937: UDP, length 1357
14:19:35.047509 IP 204.11.65.81.rev.sfr.net.https > tom.55937: UDP, length 1357
14:19:35.047575 IP tom.55937 > 204.11.65.81.rev.sfr.net.https: UDP, length 33
14:19:35.047832 IP tom.55937 > 204.11.65.81.rev.sfr.net.https: UDP, length 33
14:19:35.056978 IP 204.11.65.81.rev.sfr.net.https > tom.55937: UDP, length 1357
14:19:35.057071 IP 204.11.65.81.rev.sfr.net.https > tom.55937: UDP, length 1357
14:19:35.057185 IP 204.11.65.81.rev.sfr.net.https > tom.55937: UDP, length 1357
14:19:35.057298 IP 204.11.65.81.rev.sfr.net.https > tom.55937: UDP, length 1357
14:19:35.057412 IP 204.11.65.81.rev.sfr.net.https > tom.55937: UDP, length 1357
14:19:35.057525 IP 204.11.65.81.rev.sfr.net.https > tom.55937: UDP, length 1357
14:19:35.057640 IP 204.11.65.81.rev.sfr.net.https > tom.55937: UDP, length 1357
14:19:35.057755 IP 204.11.65.81.rev.sfr.net.https > tom.55937: UDP, length 1357
14:19:35.057883 IP 204.11.65.81.rev.sfr.net.https > tom.55937: UDP, length 1357
14:19:35.057985 IP 204.11.65.81.rev.sfr.net.https > tom.55937: UDP, length 1357
14:19:35.058096 IP 204.11.65.81.rev.sfr.net.https > tom.55937: UDP, length 1357
14:19:35.058209 IP 204.11.65.81.rev.sfr.net.https > tom.55937: UDP, length 1357
14:19:35.058322 IP 204.11.65.81.rev.sfr.net.https > tom.55937: UDP, length 1357
14:19:35.058436 IP 204.11.65.81.rev.sfr.net.https > tom.55937: UDP, length 1357
14:19:35.058550 IP 204.11.65.81.rev.sfr.net.https > tom.55937: UDP, length 1357
14:19:35.058664 IP 204.11.65.81.rev.sfr.net.https > tom.55937: UDP, length 1357
14:19:35.058778 IP 204.11.65.81.rev.sfr.net.https > tom.55937: UDP, length 1357
14:19:35.058892 IP 204.11.65.81.rev.sfr.net.https > tom.55937: UDP, length 1357
14:19:35.059007 IP 204.11.65.81.rev.sfr.net.https > tom.55937: UDP, length 1357
14:19:35.059125 IP 204.11.65.81.rev.sfr.net.https > tom.55937: UDP, length 1357
14:19:35.059236 IP 204.11.65.81.rev.sfr.net.https > tom.55937: UDP, length 1357
14:19:35.060218 IP tom.55937 > 204.11.65.81.rev.sfr.net.https: UDP, length 33
14:19:35.069638 IP 204.11.65.81.rev.sfr.net.https > tom.55937: UDP, length 1357
14:19:35.069717 IP 204.11.65.81.rev.sfr.net.https > tom.55937: UDP, length 1357
14:19:35.069879 IP 204.11.65.81.rev.sfr.net.https > tom.55937: UDP, length 1357
14:19:35.069992 IP 204.11.65.81.rev.sfr.net.https > tom.55937: UDP, length 1357
14:19:35.070224 IP tom.55937 > 204.11.65.81.rev.sfr.net.https: UDP, length 33
14:19:35.070694 IP 204.11.65.81.rev.sfr.net.https > tom.55937: UDP, length 1357
14:19:35.070783 IP 204.11.65.81.rev.sfr.net.https > tom.55937: UDP, length 1357
14:19:35.071245 IP tom.55937 > 204.11.65.81.rev.sfr.net.https: UDP, length 33
14:19:35.071593 IP 204.11.65.81.rev.sfr.net.https > tom.55937: UDP, length 1357
14:19:35.074930 IP 204.11.65.81.rev.sfr.net.https > tom.55937: UDP, length 1357
14:19:35.074986 IP 204.11.65.81.rev.sfr.net.https > tom.55937: UDP, length 1357
14:19:35.075009 IP 204.11.65.81.rev.sfr.net.https > tom.55937: UDP, length 1357
14:19:35.075093 IP 204.11.65.81.rev.sfr.net.https > tom.55937: UDP, length 1357
14:19:35.075207 IP 204.11.65.81.rev.sfr.net.https > tom.55937: UDP, length 1357
14:19:35.075321 IP 204.11.65.81.rev.sfr.net.https > tom.55937: UDP, length 1357
14:19:35.075434 IP 204.11.65.81.rev.sfr.net.https > tom.55937: UDP, length 1357
14:19:35.075549 IP 204.11.65.81.rev.sfr.net.https > tom.55937: UDP, length 1357
14:19:35.075663 IP 204.11.65.81.rev.sfr.net.https > tom.55937: UDP, length 1357
14:19:35.075780 IP tom.55937 > 204.11.65.81.rev.sfr.net.https: UDP, length 33
14:19:35.075794 IP 204.11.65.81.rev.sfr.net.https > tom.55937: UDP, length 1357
14:19:35.075897 IP 204.11.65.81.rev.sfr.net.https > tom.55937: UDP, length 1357
14:19:35.076011 IP 204.11.65.81.rev.sfr.net.https > tom.55937: UDP, length 1357
14:19:35.076125 IP 204.11.65.81.rev.sfr.net.https > tom.55937: UDP, length 1357
14:19:35.076239 IP 204.11.65.81.rev.sfr.net.https > tom.55937: UDP, length 1357
14:19:35.076353 IP 204.11.65.81.rev.sfr.net.https > tom.55937: UDP, length 1357
14:19:35.076467 IP 204.11.65.81.rev.sfr.net.https > tom.55937: UDP, length 1357
14:19:35.077691 IP tom.55937 > 204.11.65.81.rev.sfr.net.https: UDP, length 33
14:19:35.085599 IP 204.11.65.81.rev.sfr.net.https > tom.55937: UDP, length 1357
14:19:35.085657 IP 204.11.65.81.rev.sfr.net.https > tom.55937: UDP, length 1357
14:19:35.085690 IP 204.11.65.81.rev.sfr.net.https > tom.55937: UDP, length 1357
14:19:35.085796 IP 204.11.65.81.rev.sfr.net.https > tom.55937: UDP, length 1357
14:19:35.085910 IP 204.11.65.81.rev.sfr.net.https > tom.55937: UDP, length 1357
14:19:35.086025 IP 204.11.65.81.rev.sfr.net.https > tom.55937: UDP, length 1357
14:19:35.086138 IP 204.11.65.81.rev.sfr.net.https > tom.55937: UDP, length 1357
14:19:35.086252 IP 204.11.65.81.rev.sfr.net.https > tom.55937: UDP, length 1357
14:19:35.086366 IP 204.11.65.81.rev.sfr.net.https > tom.55937: UDP, length 1357
14:19:35.086480 IP 204.11.65.81.rev.sfr.net.https > tom.55937: UDP, length 1357
14:19:35.086593 IP 204.11.65.81.rev.sfr.net.https > tom.55937: UDP, length 1357
14:19:35.086707 IP 204.11.65.81.rev.sfr.net.https > tom.55937: UDP, length 1357
14:19:35.086821 IP 204.11.65.81.rev.sfr.net.https > tom.55937: UDP, length 1357
14:19:35.086988 IP 204.11.65.81.rev.sfr.net.https > tom.55937: UDP, length 1357
14:19:35.087104 IP 204.11.65.81.rev.sfr.net.https > tom.55937: UDP, length 1357
14:19:35.087219 IP 204.11.65.81.rev.sfr.net.https > tom.55937: UDP, length 1357
14:19:35.087329 IP 204.11.65.81.rev.sfr.net.https > tom.55937: UDP, length 1357

14:19:56.910240 IP (tos 0x0, ttl 1, id 0, offset 0, flags [DF], proto UDP (17), length 296)
    Chambre.orbix-locator > 239.255.255.250.ssdp: [udp sum ok] UDP, length 268
14:19:56.911330 IP (tos 0x0, ttl 1, id 0, offset 0, flags [DF], proto UDP (17), length 331)
    Chambre.orbix-locator > 239.255.255.250.ssdp: [udp sum ok] UDP, length 303
14:19:56.911344 IP (tos 0x0, ttl 1, id 0, offset 0, flags [DF], proto UDP (17), length 287)
    Chambre.orbix-locator > 239.255.255.250.ssdp: [udp sum ok] UDP, length 259
14:19:56.913807 IP (tos 0x0, ttl 1, id 0, offset 0, flags [DF], proto UDP (17), length 315)
    Chambre.orbix-locator > 239.255.255.250.ssdp: [udp sum ok] UDP, length 287
14:19:56.972322 ARP, Ethernet (len 6), IPv4 (len 4), Request who-has amazon-264387ef0 (Broadcast) tell _gateway, length 46
14:19:57.716965 IP (tos 0x0, ttl 64, id 43465, offset 0, flags [DF], proto UDP (17), length 74)
    tom.48333 > _gateway.domain: [bad udp cksum 0x83d2 -> 0x7de5!] 19750+ PTR? 250.255.255.239.in-addr.arpa. (46)
14:19:57.720882 IP (tos 0x0, ttl 64, id 0, offset 0, flags [DF], proto UDP (17), length 74)
    _gateway.domain > tom.48333: [udp sum ok] 19750 NXDomain q: PTR? 250.255.255.239.in-addr.arpa. 0/0/0 (46)
14:19:57.721707 IP (tos 0x0, ttl 64, id 43466, offset 0, flags [DF], proto UDP (17), length 71)
    tom.37852 > _gateway.domain: [bad udp cksum 0x83cf -> 0xac7e!] 47022+ PTR? 37.1.168.192.in-addr.arpa. (43)
14:19:57.725525 IP (tos 0x0, ttl 64, id 0, offset 0, flags [DF], proto UDP (17), length 92)
    _gateway.domain > tom.37852: [udp sum ok] 47022* q: PTR? 37.1.168.192.in-addr.arpa. 1/0/0 37.1.168.192.in-addr.arpa. [0s] PTR Chambre. (64)
14:19:57.726404 IP (tos 0x0, ttl 64, id 43468, offset 0, flags [DF], proto UDP (17), length 71)
    tom.47583 > _gateway.domain: [bad udp cksum 0x83cf -> 0xc76a!] 30907+ PTR? 75.1.168.192.in-addr.arpa. (43)
14:19:57.731277 IP (tos 0x0, ttl 64, id 0, offset 0, flags [DF], proto UDP (17), length 101)
    _gateway.domain > tom.47583: [udp sum ok] 30907* q: PTR? 75.1.168.192.in-addr.arpa. 1/0/0 75.1.168.192.in-addr.arpa. [0s] PTR amazon-264387ef0. (73)
14:19:58.060657 ARP, Ethernet (len 6), IPv4 (len 4), Request who-has tom (Broadcast) tell _gateway, length 46
14:19:58.060690 ARP, Ethernet (len 6), IPv4 (len 4), Reply tom is-at 48:ba:4e:96:53:b1 (oui Unknown), length 28
14:19:58.876790 IP (tos 0x0, ttl 64, id 0, offset 0, flags [DF], proto UDP (17), length 1148)
    tom.55937 > 204.11.65.81.rev.sfr.net.https: [bad udp cksum 0x2368 -> 0x770c!] UDP, length 1120
14:19:58.941871 IP (tos 0x0, ttl 117, id 8417, offset 0, flags [none], proto UDP (17), length 60)
    204.11.65.81.rev.sfr.net.https > tom.55937: [udp sum ok] UDP, length 32
14:19:58.941905 IP (tos 0x0, ttl 117, id 8418, offset 0, flags [none], proto UDP (17), length 165)
    204.11.65.81.rev.sfr.net.https > tom.55937: [udp sum ok] UDP, length 137
14:19:58.942801 IP (tos 0x0, ttl 64, id 0, offset 0, flags [DF], proto UDP (17), length 66)
    tom.55937 > 204.11.65.81.rev.sfr.net.https: [bad udp cksum 0x1f2e -> 0x9059!] UDP, length 38
14:19:58.952767 IP (tos 0x0, ttl 117, id 8419, offset 0, flags [none], proto UDP (17), length 1380)
    204.11.65.81.rev.sfr.net.https > tom.55937: [udp sum ok] UDP, length 1352
14:19:58.952807 IP (tos 0x0, ttl 117, id 8420, offset 0, flags [none], proto UDP (17), length 1385)
    204.11.65.81.rev.sfr.net.https > tom.55937: [udp sum ok] UDP, length 1357
14:19:58.952860 IP (tos 0x0, ttl 117, id 8421, offset 0, flags [none], proto UDP (17), length 1385)
    204.11.65.81.rev.sfr.net.https > tom.55937: [udp sum ok] UDP, length 1357
14:19:58.953105 IP (tos 0x0, ttl 117, id 8422, offset 0, flags [none], proto UDP (17), length 1385)
    204.11.65.81.rev.sfr.net.https > tom.55937: [udp sum ok] UDP, length 1357
14:19:58.953130 IP (tos 0x0, ttl 117, id 8423, offset 0, flags [none], proto UDP (17), length 1385)
    204.11.65.81.rev.sfr.net.https > tom.55937: [udp sum ok] UDP, length 1357
14:19:58.953285 IP (tos 0x0, ttl 117, id 8424, offset 0, flags [none], proto UDP (17), length 1385)
    204.11.65.81.rev.sfr.net.https > tom.55937: [udp sum ok] UDP, length 1357
14:19:58.953319 IP (tos 0x0, ttl 117, id 8425, offset 0, flags [none], proto UDP (17), length 1385)
    204.11.65.81.rev.sfr.net.https > tom.55937: [udp sum ok] UDP, length 1357
14:19:58.953554 IP (tos 0x0, ttl 117, id 8426, offset 0, flags [none], proto UDP (17), length 1385)
    204.11.65.81.rev.sfr.net.https > tom.55937: [udp sum ok] UDP, length 1357
14:19:58.953587 IP (tos 0x0, ttl 117, id 8427, offset 0, flags [none], proto UDP (17), length 1385)
    204.11.65.81.rev.sfr.net.https > tom.55937: [udp sum ok] UDP, length 1357
14:19:58.953696 IP (tos 0x0, ttl 64, id 0, offset 0, flags [DF], proto UDP (17), length 61)
    tom.55937 > 204.11.65.81.rev.sfr.net.https: [bad udp cksum 0x1f29 -> 0x6dc2!] UDP, length 33
14:19:58.953789 IP (tos 0x0, ttl 117, id 8428, offset 0, flags [none], proto UDP (17), length 1385)
    204.11.65.81.rev.sfr.net.https > tom.55937: [udp sum ok] UDP, length 1357
14:19:58.953904 IP (tos 0x0, ttl 117, id 8429, offset 0, flags [none], proto UDP (17), length 1385)
    204.11.65.81.rev.sfr.net.https > tom.55937: [udp sum ok] UDP, length 1357
14:19:58.954056 IP (tos 0x0, ttl 117, id 8430, offset 0, flags [none], proto UDP (17), length 1385)
    204.11.65.81.rev.sfr.net.https > tom.55937: [udp sum ok] UDP, length 1357
14:19:58.954089 IP (tos 0x0, ttl 117, id 8423, offset 0, flags [none], proto UDP (17), length 1385)
    204.11.65.81.rev.sfr.net.https > tom.55937: [udp sum ok] UDP, length 1357
14:19:58.954101 IP (tos 0x0, ttl 64, id 0, offset 0, flags [DF], proto UDP (17), length 61)
    tom.55937 > 204.11.65.81.rev.sfr.net.https: [bad udp cksum 0x1f29 -> 0x2043!] UDP, length 33
14:19:58.954240 IP (tos 0x0, ttl 117, id 8424, offset 0, flags [none], proto UDP (17), length 1385)
    204.11.65.81.rev.sfr.net.https > tom.55937: [udp sum ok] UDP, length 1357
14:19:58.954412 IP (tos 0x0, ttl 117, id 8425, offset 0, flags [none], proto UDP (17), length 1385)
    204.11.65.81.rev.sfr.net.https > tom.55937: [udp sum ok] UDP, length 1357
14:19:58.954458 IP (tos 0x0, ttl 64, id 0, offset 0, flags [DF], proto UDP (17), length 61)
    tom.55937 > 204.11.65.81.rev.sfr.net.https: [bad udp cksum 0x1f29 -> 0x4c8c!] UDP, length 33
14:19:58.964826 IP (tos 0x0, ttl 117, id 8426, offset 0, flags [none], proto UDP (17), length 1385)
    204.11.65.81.rev.sfr.net.https > tom.55937: [udp sum ok] UDP, length 1357
14:19:58.965182 IP (tos 0x0, ttl 117, id 8424, offset 0, flags [none], proto UDP (17), length 1385)
    204.11.65.81.rev.sfr.net.https > tom.55937: [udp sum ok] UDP, length 1357
14:19:58.965283 IP (tos 0x0, ttl 117, id 8425, offset 0, flags [none], proto UDP (17), length 1385)
    204.11.65.81.rev.sfr.net.https > tom.55937: [udp sum ok] UDP, length 1357
14:19:58.965314 IP (tos 0x0, ttl 64, id 0, offset 0, flags [DF], proto UDP (17), length 61)
    tom.55937 > 204.11.65.81.rev.sfr.net.https: [bad udp cksum 0x1f29 -> 0x609d!] UDP, length 33
14:19:58.965449 IP (tos 0x0, ttl 117, id 8426, offset 0, flags [none], proto UDP (17), length 1385)
    204.11.65.81.rev.sfr.net.https > tom.55937: [udp sum ok] UDP, length 1357
14:19:58.965549 IP (tos 0x0, ttl 117, id 8427, offset 0, flags [none], proto UDP (17), length 1385)
    204.11.65.81.rev.sfr.net.https > tom.55937: [udp sum ok] UDP, length 1357
14:19:58.965623 IP (tos 0x0, ttl 117, id 8426, offset 0, flags [none], proto UDP (17), length 1385)
    204.11.65.81.rev.sfr.net.https > tom.55937: [udp sum ok] UDP, length 1357
14:19:58.965773 IP (tos 0x0, ttl 117, id 8427, offset 0, flags [none], proto UDP (17), length 1385)
    204.11.65.81.rev.sfr.net.https > tom.55937: [udp sum ok] UDP, length 1357
14:19:58.965794 IP (tos 0x0, ttl 64, id 0, offset 0, flags [DF], proto UDP (17), length 61)
    tom.55937 > 204.11.65.81.rev.sfr.net.https: [bad udp cksum 0x1f29 -> 0xdbfe!] UDP, length 33
14:19:58.965852 IP (tos 0x0, ttl 117, id 8428, offset 0, flags [none], proto UDP (17), length 1385)
    204.11.65.81.rev.sfr.net.https > tom.55937: [udp sum ok] UDP, length 1357
14:19:58.965979 IP (tos 0x0, ttl 117, id 8429, offset 0, flags [none], proto UDP (17), length 1385)
    204.11.65.81.rev.sfr.net.https > tom.55937: [udp sum ok] UDP, length 1357
14:19:58.966078 IP (tos 0x0, ttl 117, id 8427, offset 0, flags [none], proto UDP (17), length 1385)
    204.11.65.81.rev.sfr.net.https > tom.55937: [udp sum ok] UDP, length 1357
14:19:58.966192 IP (tos 0x0, ttl 117, id 8428, offset 0, flags [none], proto UDP (17), length 1385)
    204.11.65.81.rev.sfr.net.https > tom.55937: [udp sum ok] UDP, length 1357
14:19:58.966307 IP (tos 0x0, ttl 117, id 8429, offset 0, flags [none], proto UDP (17), length 1385)
    204.11.65.81.rev.sfr.net.https > tom.55937: [udp sum ok] UDP, length 1357
14:19:58.966424 IP (tos 0x0, ttl 117, id 8430, offset 0, flags [none], proto UDP (17), length 1385)
    204.11.65.81.rev.sfr.net.https > tom.55937: [udp sum ok] UDP, length 1357
14:19:58.966534 IP (tos 0x0, ttl 117, id 8431, offset 0, flags [none], proto UDP (17), length 1385)
    204.11.65.81.rev.sfr.net.https > tom.55937: [udp sum ok] UDP, length 1357
14:19:58.966648 IP (tos 0x0, ttl 117, id 8432, offset 0, flags [none], proto UDP (17), length 1385)
    204.11.65.81.rev.sfr.net.https > tom.55937: [udp sum ok] UDP, length 1357
14:19:58.966763 IP (tos 0x0, ttl 117, id 8433, offset 0, flags [none], proto UDP (17), length 1385)
    204.11.65.81.rev.sfr.net.https > tom.55937: [udp sum ok] UDP, length 1357
14:19:58.967059 IP (tos 0x0, ttl 64, id 0, offset 0, flags [DF], proto UDP (17), length 61)
    tom.55937 > 204.11.65.81.rev.sfr.net.https: [bad udp cksum 0x1f29 -> 0xa5e8!] UDP, length 33
14:19:58.977208 IP (tos 0x0, ttl 117, id 8434, offset 0, flags [none], proto UDP (17), length 1385)
    204.11.65.81.rev.sfr.net.https > tom.55937: [udp sum ok] UDP, length 1357
14:19:58.977244 IP (tos 0x0, ttl 117, id 8432, offset 0, flags [none], proto UDP (17), length 1385)
    204.11.65.81.rev.sfr.net.https > tom.55937: [udp sum ok] UDP, length 1357
14:19:58.977501 IP (tos 0x0, ttl 117, id 8433, offset 0, flags [none], proto UDP (17), length 1385)
    204.11.65.81.rev.sfr.net.https > tom.55937: [udp sum ok] UDP, length 1357
14:19:58.977558 IP (tos 0x0, ttl 117, id 8434, offset 0, flags [none], proto UDP (17), length 1385)
    204.11.65.81.rev.sfr.net.https > tom.55937: [udp sum ok] UDP, length 1357
14:19:58.977573 IP (tos 0x0, ttl 117, id 8435, offset 0, flags [none], proto UDP (17), length 1385)
    204.11.65.81.rev.sfr.net.https > tom.55937: [udp sum ok] UDP, length 1357
14:19:58.977765 IP (tos 0x0, ttl 117, id 8433, offset 0, flags [none], proto UDP (17), length 1385)
    204.11.65.81.rev.sfr.net.https > tom.55937: [udp sum ok] UDP, length 1357
14:19:58.977799 IP (tos 0x0, ttl 117, id 8434, offset 0, flags [none], proto UDP (17), length 1385)
    204.11.65.81.rev.sfr.net.https > tom.55937: [udp sum ok] UDP, length 1357
14:19:58.977993 IP (tos 0x0, ttl 117, id 8435, offset 0, flags [none], proto UDP (17), length 1385)
    204.11.65.81.rev.sfr.net.https > tom.55937: [udp sum ok] UDP, length 1357
14:19:58.978091 IP (tos 0x0, ttl 64, id 0, offset 0, flags [DF], proto UDP (17), length 61)
    tom.55937 > 204.11.65.81.rev.sfr.net.https: [bad udp cksum 0x1f29 -> 0x63ef!] UDP, length 33
14:19:58.978212 IP (tos 0x0, ttl 117, id 8436, offset 0, flags [none], proto UDP (17), length 1385)
    204.11.65.81.rev.sfr.net.https > tom.55937: [udp sum ok] UDP, length 1357
14:19:58.978244 IP (tos 0x0, ttl 117, id 8435, offset 0, flags [none], proto UDP (17), length 1385)
    204.11.65.81.rev.sfr.net.https > tom.55937: [udp sum ok] UDP, length 1357
14:19:58.978528 IP (tos 0x0, ttl 117, id 8436, offset 0, flags [none], proto UDP (17), length 1385)
    204.11.65.81.rev.sfr.net.https > tom.55937: [udp sum ok] UDP, length 1357
14:19:58.978583 IP (tos 0x0, ttl 117, id 8437, offset 0, flags [none], proto UDP (17), length 1385)
    204.11.65.81.rev.sfr.net.https > tom.55937: [udp sum ok] UDP, length 1357
14:19:58.978594 IP (tos 0x0, ttl 64, id 0, offset 0, flags [DF], proto UDP (17), length 61)
    tom.55937 > 204.11.65.81.rev.sfr.net.https: [bad udp cksum 0x1f29 -> 0x1126!] UDP, length 33
14:19:58.978730 IP (tos 0x0, ttl 117, id 8438, offset 0, flags [none], proto UDP (17), length 1385)
    204.11.65.81.rev.sfr.net.https > tom.55937: [udp sum ok] UDP, length 1357
14:19:58.979355 IP (tos 0x0, ttl 117, id 8436, offset 0, flags [none], proto UDP (17), length 1385)
    204.11.65.81.rev.sfr.net.https > tom.55937: [udp sum ok] UDP, length 1357
14:19:58.979402 IP (tos 0x0, ttl 117, id 8437, offset 0, flags [none], proto UDP (17), length 1385)
    204.11.65.81.rev.sfr.net.https > tom.55937: [udp sum ok] UDP, length 1357
14:19:58.979673 IP (tos 0x0, ttl 64, id 0, offset 0, flags [DF], proto UDP (17), length 61)
    tom.55937 > 204.11.65.81.rev.sfr.net.https: [bad udp cksum 0x1f29 -> 0x245c!] UDP, length 33
14:19:58.980126 IP (tos 0x0, ttl 117, id 8438, offset 0, flags [none], proto UDP (17), length 1385)
    204.11.65.81.rev.sfr.net.https > tom.55937: [udp sum ok] UDP, length 1357
14:19:58.980337 IP (tos 0x0, ttl 64, id 0, offset 0, flags [DF], proto UDP (17), length 61)
    tom.55937 > 204.11.65.81.rev.sfr.net.https: [bad udp cksum 0x1f29 -> 0x5674!] UDP, length 33
14:19:58.980984 IP (tos 0x0, ttl 117, id 8439, offset 0, flags [none], proto UDP (17), length 1385)
    204.11.65.81.rev.sfr.net.https > tom.55937: [udp sum ok] UDP, length 1357
14:19:58.981551 IP (tos 0x0, ttl 64, id 0, offset 0, flags [DF], proto UDP (17), length 61)
    tom.55937 > 204.11.65.81.rev.sfr.net.https: [bad udp cksum 0x1f29 -> 0xdcda!] UDP, length 33
14:19:58.981813 IP (tos 0x0, ttl 117, id 8439, offset 0, flags [none], proto UDP (17), length 1385)
    204.11.65.81.rev.sfr.net.https > tom.55937: [udp sum ok] UDP, length 1357
14:19:58.981868 IP (tos 0x0, ttl 117, id 8440, offset 0, flags [none], proto UDP (17), length 1385)
    204.11.65.81.rev.sfr.net.https > tom.55937: [udp sum ok] UDP, length 1357
14:19:58.982487 IP (tos 0x0, ttl 64, id 0, offset 0, flags [DF], proto UDP (17), length 61)
    tom.55937 > 204.11.65.81.rev.sfr.net.https: [bad udp cksum 0x1f29 -> 0x83b0!] UDP, length 33
14:19:58.992482 IP (tos 0x0, ttl 117, id 8441, offset 0, flags [none], proto UDP (17), length 1385)
    204.11.65.81.rev.sfr.net.https > tom.55937: [udp sum ok] UDP, length 1357
14:19:58.992525 IP (tos 0x0, ttl 117, id 8442, offset 0, flags [none], proto UDP (17), length 1385)
    204.11.65.81.rev.sfr.net.https > tom.55937: [udp sum ok] UDP, length 1357
14:19:58.992573 IP (tos 0x0, ttl 117, id 8441, offset 0, flags [none], proto UDP (17), length 1385)
    204.11.65.81.rev.sfr.net.https > tom.55937: [udp sum ok] UDP, length 1357
14:19:58.992734 IP (tos 0x0, ttl 117, id 8442, offset 0, flags [none], proto UDP (17), length 1385)
    204.11.65.81.rev.sfr.net.https > tom.55937: [udp sum ok] UDP, length 1357
14:19:58.992848 IP (tos 0x0, ttl 117, id 8443, offset 0, flags [none], proto UDP (17), length 1385)
    204.11.65.81.rev.sfr.net.https > tom.55937: [udp sum ok] UDP, length 1357
14:19:58.992961 IP (tos 0x0, ttl 117, id 8444, offset 0, flags [none], proto UDP (17), length 1385)
    204.11.65.81.rev.sfr.net.https > tom.55937: [udp sum ok] UDP, length 1357
14:19:58.993075 IP (tos 0x0, ttl 117, id 8443, offset 0, flags [none], proto UDP (17), length 1385)
    204.11.65.81.rev.sfr.net.https > tom.55937: [udp sum ok] UDP, length 1357
14:19:58.993190 IP (tos 0x0, ttl 117, id 8444, offset 0, flags [none], proto UDP (17), length 1385)
    204.11.65.81.rev.sfr.net.https > tom.55937: [udp sum ok] UDP, length 1357
14:19:58.993245 IP (tos 0x0, ttl 117, id 8445, offset 0, flags [none], proto UDP (17), length 1385)
    204.11.65.81.rev.sfr.net.https > tom.55937: [udp sum ok] UDP, length 1357
14:19:58.993374 IP (tos 0x0, ttl 117, id 8446, offset 0, flags [none], proto UDP (17), length 1385)
    204.11.65.81.rev.sfr.net.https > tom.55937: [udp sum ok] UDP, length 1357
14:19:58.993473 IP (tos 0x0, ttl 117, id 8444, offset 0, flags [none], proto UDP (17), length 1385)
    204.11.65.81.rev.sfr.net.https > tom.55937: [udp sum ok] UDP, length 1357
14:19:58.993585 IP (tos 0x0, ttl 117, id 8445, offset 0, flags [none], proto UDP (17), length 1385)
    204.11.65.81.rev.sfr.net.https > tom.55937: [udp sum ok] UDP, length 1357
14:19:58.993699 IP (tos 0x0, ttl 117, id 8446, offset 0, flags [none], proto UDP (17), length 1385)
    204.11.65.81.rev.sfr.net.https > tom.55937: [udp sum ok] UDP, length 1357
14:19:58.993891 IP (tos 0x0, ttl 117, id 8447, offset 0, flags [none], proto UDP (17), length 1385)
    204.11.65.81.rev.sfr.net.https > tom.55937: [udp sum ok] UDP, length 1357
14:19:58.993945 IP (tos 0x0, ttl 117, id 8445, offset 0, flags [none], proto UDP (17), length 1385)
    204.11.65.81.rev.sfr.net.https > tom.55937: [udp sum ok] UDP, length 1357
14:19:58.994091 IP (tos 0x0, ttl 117, id 8446, offset 0, flags [none], proto UDP (17), length 1385)
    204.11.65.81.rev.sfr.net.https > tom.55937: [udp sum ok] UDP, length 1357
14:19:58.994160 IP (tos 0x0, ttl 117, id 8447, offset 0, flags [none], proto UDP (17), length 1385)
    204.11.65.81.rev.sfr.net.https > tom.55937: [udp sum ok] UDP, length 1357
14:19:58.994269 IP (tos 0x0, ttl 117, id 8448, offset 0, flags [none], proto UDP (17), length 1385)
    204.11.65.81.rev.sfr.net.https > tom.55937: [udp sum ok] UDP, length 1357
14:19:58.994383 IP (tos 0x0, ttl 117, id 8447, offset 0, flags [none], proto UDP (17), length 1385)
    204.11.65.81.rev.sfr.net.https > tom.55937: [udp sum ok] UDP, length 1357
14:19:58.994502 IP (tos 0x0, ttl 117, id 8448, offset 0, flags [none], proto UDP (17), length 1385)
    204.11.65.81.rev.sfr.net.https > tom.55937: [udp sum ok] UDP, length 1357
14:19:58.995055 IP (tos 0x0, ttl 64, id 0, offset 0, flags [DF], proto UDP (17), length 61)
    tom.55937 > 204.11.65.81.rev.sfr.net.https: [bad udp cksum 0x1f29 -> 0x4d66!] UDP, length 33
14:19:59.004806 IP (tos 0x0, ttl 117, id 8449, offset 0, flags [none], proto UDP (17), length 1385)
    204.11.65.81.rev.sfr.net.https > tom.55937: [udp sum ok] UDP, length 1357
14:19:59.005157 IP (tos 0x0, ttl 117, id 8450, offset 0, flags [none], proto UDP (17), length 1385)
    204.11.65.81.rev.sfr.net.https > tom.55937: [udp sum ok] UDP, length 1357
14:19:59.005235 IP (tos 0x0, ttl 117, id 8448, offset 0, flags [none], proto UDP (17), length 1385)
    204.11.65.81.rev.sfr.net.https > tom.55937: [udp sum ok] UDP, length 1357
14:19:59.005353 IP (tos 0x0, ttl 117, id 8449, offset 0, flags [none], proto UDP (17), length 1385)
    204.11.65.81.rev.sfr.net.https > tom.55937: [udp sum ok] UDP, length 1357
14:19:59.005462 IP (tos 0x0, ttl 117, id 8450, offset 0, flags [none], proto UDP (17), length 1385)
    204.11.65.81.rev.sfr.net.https > tom.55937: [udp sum ok] UDP, length 1357
14:19:59.005577 IP (tos 0x0, ttl 117, id 8451, offset 0, flags [none], proto UDP (17), length 1385)
    204.11.65.81.rev.sfr.net.https > tom.55937: [udp sum ok] UDP, length 1357
14:19:59.005706 IP (tos 0x0, ttl 117, id 8452, offset 0, flags [none], proto UDP (17), length 1385)
    204.11.65.81.rev.sfr.net.https > tom.55937: [udp sum ok] UDP, length 1357
14:19:59.005817 IP (tos 0x0, ttl 117, id 8453, offset 0, flags [none], proto UDP (17), length 1385)
    204.11.65.81.rev.sfr.net.https > tom.55937: [udp sum ok] UDP, length 1357
14:19:59.005919 IP (tos 0x0, ttl 117, id 8454, offset 0, flags [none], proto UDP (17), length 1385)
    204.11.65.81.rev.sfr.net.https > tom.55937: [udp sum ok] UDP, length 1357
